{"resources":[{"kind":"ROM_BLOB","ordinal":0,"rangeRequired":false,"role":"game","sha256":"dddddddddddddddddddddddddddddddddddddddddddddddddddddddddddddddd","sizeBytes":3,"url":"/runtime/session/content/game"}],"restore":{"format":"fixture-state-v1","sha256":"eeeeeeeeeeeeeeeeeeeeeeeeeeeeeeeeeeeeeeeeeeeeeeeeeeeeeeeeeeeeeeee","sizeBytes":3,"url":"/runtime/session/restore"},"runtime":{"bundleSha256":"bbbbbbbbbbbbbbbbbbbbbbbbbbbbbbbbbbbbbbbbbbbbbbbbbbbbbbbbbbbbbbbb","capabilities":{"checkpoint":true,"contentLoading":"PRELOAD_ONLY","discSwitch":false,"frameCounter":true,"frameMode":"SAME_ORIGIN_BLANK","inputFilter":true,"nativeSettings":true,"pause":true,"requiresThreads":false,"screenshot":true,"standardGamepad":true,"videoModes":["original","pixel"],"volume":true},"checkpoint":{"maxBytes":9007199254740991,"readFormats":["fixture-state-v1","legacy-state-v1"],"writeFormat":"fixture-state-v1"},"moduleSha256":"aaaaaaaaaaaaaaaaaaaaaaaaaaaaaaaaaaaaaaaaaaaaaaaaaaaaaaaaaaaaaaaa","moduleUrl":"/runtime/providers/fixture/bbbbbbbbbbbbbbbbbbbbbbbbbbbbbbbbbbbbbbbbbbbbbbbbbbbbbbbbbbbbbbbb/client.mjs","providerApiVersion":2,"providerId":"fixture","providerVersion":"1.0.0","runtimeBaseUrl":"/runtime/providers/fixture/bbbbbbbbbbbbbbbbbbbbbbbbbbbbbbbbbbbbbbbbbbbbbbbbbbbbbbbbbbbbbbbb/","targetId":"fixture"},"schemaVersion":1,"session":{"coreName":"Fixture Core","id":"018f0f31-26fe-7a31-9d61-4ec92f16d4c3","mode":"SINGLE","platformName":"Fixture","purpose":"REVIEW_PREVIEW","returnTo":"/review/fixture","title":"Checkpoint fixture","warnings":["fixture warning"]},"targetOptions":{"array":[null,true,9007199254740991],"bmp":"运行时","pair":"🚀"}}
